original,translation,Agreement
"I agree that it is important for standardized methods of assessment to exist for confirmation and monitoring of a diagnosis. Such methods can also be used by a variety of healthcare professionals as an initial screening or monitoring tool. Such methods are also important for purposes of robust research. However, I think clinical judgement is also important as an overall assessment of that person's mental health and that ideally all potentially depressed patients should be assessed and judged clinically by an experienced clinican.","I agree that it is important for standardized methods of assessment to exist for confirmation and monitoring of a diagnosis. Such methods can also be used by a variety of healthcare professionals as an initial screening or monitoring tool. Such methods are also important for purposes of robust research. However, I think clinical judgement is also important as an overall assessment of that person's mental health and that ideally all potentially depressed patients should be assessed and judged clinically by an experienced clinican.","5. somewhat
agree"
Each individual is different and will not fit the same standards.,Each individual is different and will not fit the same standards.,"3. somewhat
disagree"
"Every individual case is different. It’s that no one size fits all, and although you can start out with a very fixed plan, it doesn’t always work.","Every individual case is different. It’s that no one size fits all, and although you can start out with a very fixed plan, it doesn’t always work.",4. neutral
People may not show classic symptoms but new unreported signs of depression,People may not show classic symptoms but new unreported signs of depression,4. neutral
"The validity of these measures is about accurately capturing the presence and severity of depression, while reliability ensures that the results are not influenced by random factors.","The validity of these measures is about accurately capturing the presence and severity of depression, while reliability ensures that the results are not influenced by random factors.",6. agree
"I use standardized because they are required by my employer.  If I had the option, I would use other means, more conversational, more empathetic and means that cater to the individual.  I am required to stick to a ""script"" and always have a scribe in the room.","I use standardized because they are required by my employer. If I had the option, I would use other means, more conversational, more empathetic and means that cater to the individual. I am required to stick to a ""script"" and always have a scribe in the room.","1. strongly
disagree"
Its not always necessary to use standardised assessment tools as long as they fulfill criteria of depression based on guidelines,Its not always necessary to use standardised assessment tools as long as they fulfill criteria of depression based on guidelines,"5. somewhat
agree"
No comment,No comment,6. agree
Care should be personal centred and not standardised,Care should be personal centred and not standardised,"3. somewhat
disagree"
We work in an outpatient setting where we do not follow up on patients. We do what we can but it is good to have a somewhat standardized assessment across all platforms and providers so people assess similarly,We work in an outpatient setting where we do not follow up on patients. We do what we can but it is good to have a somewhat standardized assessment across all platforms and providers so people assess similarly,"5. somewhat
agree"
Not everyone fits into the same box so I feel it is important to use different assessments,Not everyone fits into the same box so I feel it is important to use different assessments,"3. somewhat
disagree"
"Assessment models are useful if clinicians are inexperienced, but in my opinion experience and having the freedom to fully explore symptoms is more valuable in making a diagnosis.","Assessment models are useful if clinicians are inexperienced, but in my opinion experience and having the freedom to fully explore symptoms is more valuable in making a diagnosis.",2. disagree
There needs to be some uniform charting on the patient assessment. That way the provider can diagnose fairly,There needs to be some uniform charting on the patient assessment. That way the provider can diagnose fairly,"5. somewhat
agree"
"The clinical interview is the most important piece of assessment, but validated tools should be used for collateral confirmation for a good diagnostic approach.","The clinical interview is the most important piece of assessment, but validated tools should be used for collateral confirmation for a good diagnostic approach.",6. agree
I agree that it needs to be measured with method that has high validity and reliability because it is a very sensitive subject and misdiagnosis can have bad consequences,I agree that it needs to be measured with method that has high validity and reliability because it is a very sensitive subject and misdiagnosis can have bad consequences,"5. somewhat
agree"
"When working in a clinical setting, it is important to use tried and true assessment methods to determine depression risk of an individual.","When working in a clinical setting, it is important to use tried and true assessment methods to determine depression risk of an individual.","7. strongly
agree"
Clinical research is very important to create standards. Some depression can be temporary and not a chemical imbalance so it's important to use any tools available.,Clinical research is very important to create standards. Some depression can be temporary and not a chemical imbalance so it's important to use any tools available.,6. agree
Standardized assessments don't take into consideration a person as an individual and the unique challenges that they face,Standardized assessments don't take into consideration a person as an individual and the unique challenges that they face,2. disagree
I think they are helpful and accurate  but shouldn’t be solely used.,I think they are helpful and accurate but shouldn’t be solely used.,6. agree
Yes i think this is really important and we should use the same or only a few measures across the clinicians to ensure comparability.,Yes i think this is really important and we should use the same or only a few measures across the clinicians to ensure comparability.,"7. strongly
agree"
I believe building rapport help better relationship outcomes,I believe building rapport help better relationship outcomes,"1. strongly
disagree"
"depressie is een zeer breed ziektebeeld en gestandaardiseerde instrumenten geven enige houvast. Dat gezegd hebbende, moet er wel ruimte zijn voor interpretatie","depression is a very broad syndrome, and standardized instruments provide some guidance. That said, there must be room for interpretation",6. agree
"Depression assessment tools standardise approach across clinician and remove bias. I work prehospitally, so my job involved referring on the more specialist clinicians.","Depression assessment tools standardise approach across clinician and remove bias. I work prehospitally, so my job involved referring on the more specialist clinicians.",6. agree
"People
With depression may display different symptoms a standard generic assessment may not suit everyone",People With depression may display different symptoms a standard generic assessment may not suit everyone,"3. somewhat
disagree"
Using proven methods that accurately assess depression is what is best for the patient.,Using proven methods that accurately assess depression is what is best for the patient.,"7. strongly
agree"
"Patients are not always standardized, but these methods work for the most part.","Patients are not always standardized, but these methods work for the most part.",6. agree
In my job we don’t offer a diagnostic assessment. We assess for symptoms of common mental health difficulties including depression for treatment in primary care or onward referral to secondary care if necessary.,In my job we don’t offer a diagnostic assessment. We assess for symptoms of common mental health difficulties including depression for treatment in primary care or onward referral to secondary care if necessary.,"5. somewhat
agree"
the assessment should be consistent,the assessment should be consistent,6. agree
I feel like these types of assessments ensure that the same information/approach is taken with each patient and allows for a more standardized definition of depression.,I feel like these types of assessments ensure that the same information/approach is taken with each patient and allows for a more standardized definition of depression.,"7. strongly
agree"
It is important to use quantitative data when conducting an assessment.,It is important to use quantitative data when conducting an assessment.,6. agree
"I think using a standard scale is a great way to start the approach to the assessment, but it’s not the best way to continue and finish the assessment.","I think using a standard scale is a great way to start the approach to the assessment, but it’s not the best way to continue and finish the assessment.","5. somewhat
agree"
This would help get a baseline of their emotions. Then you would be able to see if depression is improving or worsening.,This would help get a baseline of their emotions. Then you would be able to see if depression is improving or worsening.,"5. somewhat
agree"
"As with any assessment or diagnostic tool, it is important to use methods that are proven with research that demonstrates a reasonably high degree of validity and reliability. However, there are always outliers or special cases that may fall outside the boundaries or don't meet the standards of these assessment methods","As with any assessment or diagnostic tool, it is important to use methods that are proven with research that demonstrates a reasonably high degree of validity and reliability. However, there are always outliers or special cases that may fall outside the boundaries or don't meet the standards of these assessment methods",6. agree
There does need to be a level of standardising but sometimes you get more from the person by putting the tools down and free from discussing their experience. You,There does need to be a level of standardising but sometimes you get more from the person by putting the tools down and free from discussing their experience. You,"5. somewhat
agree"
"I do feel that to use a standardised assessment form would be gold standard care, it gives a reliable base screen that then can be used again to judge treatment and progression. I should use this more often but am often time limited and patents will often be keen to talk and use unstructured discussion.","I do feel that to use a standardised assessment form would be gold standard care, it gives a reliable base screen that then can be used again to judge treatment and progression. I should use this more often but am often time limited and patents will often be keen to talk and use unstructured discussion.",6. agree
"Het is belangrijk om een methode aan te houden zodat iedereen op dezelfde manier werkt en er binnen de zorg een lijn wordt aangehouden, maar tegelijkertijd is iedereen weer anders en vallen er regelmatig mensen buiten de richtlijnen. Afwijkend van protocol of methode","It is important to adhere to a method so that everyone works the same way and a line is maintained within care, but at the same time everyone is different and people regularly fall outside the guidelines.Deviating from protocol or method","5. somewhat
agree"
It is importance to do what is right.,It is importance to do what is right.,"3. somewhat
disagree"
Sometimes it's important but this doesn't work for all patients. Clinical opinion is necessary.,Sometimes it's important but this doesn't work for all patients. Clinical opinion is necessary.,"5. somewhat
agree"
"I think it is tricky to determine the answer to this question. I think the presentations of depression can be very variable, so oftentimes I rely on simple history taking. I find that sometimes with questionnaires e.g., PHQ-9 there might be a response bias, where a patient might give answers they think I or other clinical professionals want to hear. This rating tool has high levels of statistcal support nevertheless.","I think it is tricky to determine the answer to this question. I think the presentations of depression can be very variable, so oftentimes I rely on simple history taking. I find that sometimes with questionnaires e.g., PHQ-9 there might be a response bias, where a patient might give answers they think I or other clinical professionals want to hear. This rating tool has high levels of statistcal support nevertheless.",6. agree
These assessment methods are proven and established in guidelines for a reason. They allow for a generalised definition of depression in the population,These assessment methods are proven and established in guidelines for a reason. They allow for a generalised definition of depression in the population,"7. strongly
agree"
"This is useful especially in a setting that allows for this ie clinic visit/office; working in an emergency setting there is often not time or resources to go though many of the structured interviews; listening to patient and allowing them to tell you the diagnosis is most important in that initial setting, and then getting psychiatry involved to further risk stratify and diagnose","This is useful especially in a setting that allows for this ie clinic visit/office; working in an emergency setting there is often not time or resources to go though many of the structured interviews; listening to patient and allowing them to tell you the diagnosis is most important in that initial setting, and then getting psychiatry involved to further risk stratify and diagnose","5. somewhat
agree"
Without which you have no rationale or basis for measurement of your outcomes,Without which you have no rationale or basis for measurement of your outcomes,"7. strongly
agree"
"Our clients are in a home that is my primary place of work. Being around them all of the time, it is easier to diagnose, treat & follow-up.","Our clients are in a home that is my primary place of work. Being around them all of the time, it is easier to diagnose, treat & follow-up.",4. neutral
Clinical expertise is also important,Clinical expertise is also important,"5. somewhat
agree"
"Not everyone is a one size fits when using these methods. Some patients do not answer truthfully and as a clinician, you have to pay attention to body language as well.","Not everyone is a one size fits when using these methods. Some patients do not answer truthfully and as a clinician, you have to pay attention to body language as well.","5. somewhat
agree"
This way you don’t miss out key elements that could be overlooked,This way you don’t miss out key elements that could be overlooked,6. agree
I agree it helps but other methods are effective and more important.,I agree it helps but other methods are effective and more important.,"5. somewhat
agree"
The clinical interview is equally as important as use of standardized tools; both should be used.,The clinical interview is equally as important as use of standardized tools; both should be used.,6. agree
from a novice perspective this seems the most appropriate,from a novice perspective this seems the most appropriate,6. agree
I prefer using methods with high levels of reliability and validity as these are the ones that have been most frequently researched and proven to be beneficial in a clinical setting.,I prefer using methods with high levels of reliability and validity as these are the ones that have been most frequently researched and proven to be beneficial in a clinical setting.,"7. strongly
agree"
I feel each individual is different,I feel each individual is different,"5. somewhat
agree"
Everyone isn’t going to fit into a cookie cutter box. People have to be taken into consideration,Everyone isn’t going to fit into a cookie cutter box. People have to be taken into consideration,"5. somewhat
agree"
I think it's important to use standardized assessments because they've been tested. The only situations I would think to not ONLY use them is in cultural scenarios or when people who under report their symptoms appear more severe in session.,I think it's important to use standardized assessments because they've been tested. The only situations I would think to not ONLY use them is in cultural scenarios or when people who under report their symptoms appear more severe in session.,6. agree
"They are useful to use in conjunction with patient interview information gathering, especially to map progress.","They are useful to use in conjunction with patient interview information gathering, especially to map progress.",6. agree
"Not everyone fits into the categories of an assessment method, things need to be adjusted to an individual","Not everyone fits into the categories of an assessment method, things need to be adjusted to an individual","3. somewhat
disagree"
It is advisable to ask few questions about it,It is advisable to ask few questions about it,6. agree
I have not used structured methods for assessment. I have used scales such as ph9.,I have not used structured methods for assessment. I have used scales such as ph9.,4. neutral
