original,translation,Agreement
Det finns mycket information som en skattningsskala inte fångar som t.ex icke verbal kommunikation mimik bristfällig kontakt. Dessa depressiva tecken bör msn fråga vidare på. Anhörigintervju kan också behövas för patienter som dissimulerar,"There is a lot of information that a rating scale does not capture, such as non-verbal communication, facial expressions and lack of contact. These depressive signs should be further investigated by the msn. A family interview may also be needed for patients who conceal","5. somewhat
agree"
"Utifrån min erfarenhet är skattningsskalor och andra mätningsinstrument viktiga men måste kompletteras med klinisk intervju då patienter ofta missförstår skattningsinstrument, alternativt tolkar begrepp på ett annat sätt än det som avses.","In my experience, rating scales and other measurement instruments are important but must be supplemented with clinical interviews as patients often misunderstand rating instruments, or interpret concepts in a different way than intended.","5. somewhat
agree"
Pålitlig mätbarhet; normering samt validitet och interbedömarreliabilitet.,Reliable measurability; standardization and validity and inter-rater reliability.,"7. strongly
agree"
Mina svar baseras på utredningsarbete vid sk försäkringsmedicinska utredningar där MINI är ett obligatoriskt instrument. Och det är alltså inte förknippat med behandlingsinsatser.,My answers are based on investigation work in so-called insurance medical investigations where MINI is a mandatory instrument. And it is thus not associated with treatment interventions.,"5. somewhat
agree"
"I en primärvårdssetting så funkar inte en noggrann och tidskrävande anamnestagning. Då skulle en bråkdel av alla som söker hjälp få hjälp vilket vi också såg när vi tittade på siffrorna. Alla använda validerade skattningsskalor var till liten eller ingen hjälp heller innan vi slutade med det för skattningen var i för hög utsträckning påverkad av vårdköer. Dvs folk maxade symtom på alla formulär för att få hjälp snabbt. I rummet framkom något annat. Validerade metoder med god reliabilitet funkar bäst i forskning och i andra settings. Skulle du studera reliabilitet för samma metoder inom primärvården med vårdköer skulle siffrorna inte se bra ut. Depression som som diagnos är heller inte nödvändig att ställa på någon där livet har slagit till ex när en partner har gjort slut och man är deppig och inte hanterar det så konstruktivt. En depressionsbehandling kan användas ändå på all deppighet, direkt och samma dag som patienten söker hjälp när den är mest motiverad för att bryta den negativa spiralen. Det var vårt fokus och det funkade väldigt bra. Sedan hade vi kontinuerlig differentaldiagnistiskt tänk under behandling och framkom behov av en mer strukturerad utredning så tog vi hjälp av validerade formulär då.","In a primary care setting, thorough and time-consuming history taking does not work. 
Then a fraction of all those who seek help would get help, which we also saw when we looked at the figures. All the validated 
assessment scales used were of little or no help either before we stopped using them because the assessment was too much influenced 
by healthcare queues. That is, people maxed out symptoms on all the forms to get help quickly. Something else emerged in the room. 
Validated methods with good reliability work best in research and other settings. If you were to study the reliability of the same 
methods in primary care with care queues, the figures would not look good. Depression as a diagnosis is also not necessary to make 
on someone where life has taken a turn for the worse, for example when a partner has broken up and you are depressed and not dealing 
with it constructively. A depression treatment can be used anyway for all depression, directly and on the same day that the patient 
seeks help when it is most motivated.","3. somewhat
disagree"
Det är speciellt viktigt i tveksamma fall. Typisk depression är inte svår att upptäcka och behandla varför skattningsskalor har mindre betydelse.,"It is especially important in doubtful cases. Typical depression is not difficult to detect and treat, so rating scales are less important.",6. agree
Ik vind dat naast een gestandaardiseerde methode het klinische niet-gestructureerde interview ook vaak voldoende is. Zo ingewikkeld is een depressie vaststellen niet.,"I find that in addition to a standardized method, the clinical unstructured interview is often sufficient. Diagnosing depression is not that complicated.","3. somewhat
disagree"
Ik denk dat het altijd belangrijk is om een gestandaardiseerde beoordelingsmethode te gebruiken. Ik werk met een doelgroep waar deze niet altijd voorhanden is (verstandelijk beperkte mensen).,"I think it is always important to use a standardized method of assessment, and I work with a target group where this is not always available (mentally challenged people).","5. somewhat
agree"
Wanneer betrouwbaarheid en validiteit groot zijn meten de instrumenten wat ze moeten meten. Daarom belangrijk om dit ook af te nemen,"When reliability and validity are high, the instruments measure what they are supposed to measure, so it is important to take this too","7. strongly
agree"
Ik denk dat het per casus afhankelijk is. In sommige gevallen lijkt het evident dat er sprake is van een depressie in andere gevallen kunnen de symptomen a-typisch lijken of verscholen onder andere  symptomen.,I think it depends on a case-by-case basis. In some cases it seems obvious that depression is present in others the symptoms may seem a-typical or hidden among other symptoms.,"3. somewhat
disagree"
Gestandaardiseerde methodes vormen een basis voor de beoordeling,Standardized methods provide a basis for assessment,"5. somewhat
agree"
"Dit antwoord is anders dan hoe ik er tegenaan keek toen ik minder ervaring had. Ik heb geleerd om verder te kijken en te denken dan symptomen. Als het lukt om de symptomen goed te kunnen benoemen en classificerend een voldoende antwoord te geven is dat heel belangrijk. Maar belangrijker nog is om een beschrijvende diagnose te kunnen geven die de cliënt en het ontstaan en in stand houden van de klacht beschrijft. Dan heb je veel concreter een idee hoe je deze klachten aan kunt pakken, enkel dan een dsm diagnose.","This answer is different from how I looked at it when I had less experience.I have learned to look and think beyond symptoms.If you can manage to properly name the symptoms and give a sufficient answer classificatively, that is very important.But more important is to be able to give a descriptive diagnosis that describes the client and the origin and perpetuation of the complaint.Then you have a much more concrete idea of how to address these complaints, just than a dsm diagnosis.","5. somewhat
agree"
"Ik vind het belangrijk om het uitvragen van depressie te structureren en dat dit wetenschappelijk onderbouwd is. Echter is het ook belangrijk om rekening te houden met context en andere problematiek, waardoor ik het prettig vind dat er ruimte is om dit te bespreken ipv blind staren op diagnostiseren van depressie.","I think it is important to structure the questioning of depression and that it is scientifically based. However, it is also important to take into account context and other problems, so I like that there is room to discuss this instead of staring blindly at diagnosing depression.","5. somewhat
agree"
"Ik vind dit afhankelijk van het doel van het stellen van de diagnose. Iemand die therapie zoekt, waarbij lijdensdruk duidelijk zichtbaar is, kenmerken van depressie globaal aanwezig, is geholpen door de diagnose omdat dit nodig is om de behandeling vergoed te krijgen. Dan zijn meetinstrumenten wellicht niet noodzakelijk. Wil iemand ook toegang tot medicatie, dan vind ik validiteit en betrouwbaarheid al een stuk belangrijker. Ook in een onderzoekssetting zou ik andere meetinstrumenten gebruiken dan ik nu in de dagelijkse praktijk doe.","I think this depends on the purpose of making the diagnosis. Someone seeking therapy, where suffering is clearly visible, characteristics of depression globally present, is helped by the diagnosis because this is necessary to get treatment reimbursed. Then measuring instruments may not be necessary. If someone also wants access to medication, then I think validity and reliability are already a lot more important. Also in a research setting I would use different measuring instruments than I do now in daily practice.","5. somewhat
agree"
"De praktijk maakt het vaak moeilijk om gebruik te maken van dit soort tests, simpelweg door de gebonden tijd die besteed kan worden voor een cliënt. Vaak weeg ik, op basis van het punt in de therapeutische relatie, af of ik middels een klinische indruk de ernst van klachten beoordeel. Zo is het bij de ene cliënt meer gewenst om middels gespreksvoering de klachten in kaart te brengen, en is bij de andere cliënt mogelijk dit middels tests te doen.","The practice often makes it difficult to make use of these kinds of tests, simply because of the limited time that can be spent with a client. Often I weigh, based on the point in the therapeutic relationship, whether to assess the severity of complaints by means of a clinical impression. For example, with one client it is more desirable to assess the complaints by means of conversation, and with another client it is possible to do this by means of tests.","5. somewhat
agree"
"Bij comorbide persoonlijkheidsproblematiek, NAH of ernstige somatische aandoeningen is het soms niet afdoende
Dus als het kan ja, maar niet als starre regel aub","With comorbid personality problems, NAH or severe somatic conditions, it is sometimes not adequate So if it can be done yes, but not as a rigid rule please",4. neutral
In mijn opinie komt het werken met een diagnosesysteem de kwaliteit van de geboden zorg niet altijd ten goede.,"In my opinion, working with a diagnostic system does not always improve the quality of care provided.","3. somewhat
disagree"
In conjuncture with other sources of information.,In conjuncture with other sources of information.,"7. strongly
agree"
"Agree with statement above depending on clinical setting and client’s goals. In my private practice where I work primarily alone (I consult and collaborate with other providers as needed) and meet the client frequently  and know the person well, I don’t believe a semi-structured assessment is necessary each time, but if I need to make a formal diagnosis, I will typically draw on the SCID questions (lodged in my mind from years of research) to help me make a diagnosis. I use the DASS as my main continuous instrument today to follow up on sxs (the other instruments I endorsed, eg BDI, HRSD, I used in the past).","Agree with statement above depending on clinical setting and client’s goals. In my private practice where I work primarily alone (I consult and collaborate with other providers as needed) and meet the client frequently and know the person well, I don’t believe a semi-structured assessment is necessary each time, but if I need to make a formal diagnosis, I will typically draw on the SCID questions (lodged in my mind from years of research) to help me make a diagnosis. I use the DASS as my main continuous instrument today to follow up on sxs (the other instruments I endorsed, eg BDI, HRSD, I used in the past).","5. somewhat
agree"
Important to seek the story behind the number,Important to seek the story behind the number,"7. strongly
agree"
"It is important to use standardized instruments because they are research-based, faster than an interview, and they may detect something I did not observe. Furthermore, recording the scores on these instruments as part of the clinical record is important for supporting the diagnosis when dealing with insurers. However, it is also indispensable to follow up with the client to assess the answers and ask questions that are not on the instruments. The measurement instruments themselves are a partial picture, and are not sufficient for making a diagnosis or determining treatment.","It is important to use standardized instruments because they are research-based, faster than an interview, and they may detect something I did not observe. Furthermore, recording the scores on these instruments as part of the clinical record is important for supporting the diagnosis when dealing with insurers. However, it is also indispensable to follow up with the client to assess the answers and ask questions that are not on the instruments. The measurement instruments themselves are a partial picture, and are not sufficient for making a diagnosis or determining treatment.",6. agree
"People from certain cultural groups (e.g., military veterans, african americans, asian americans) often will not endorse many symptoms on the screening measure, but when you ask them after they have gotten to know and trust you, and understand the intent of question better, they are more likely to report depression symptoms.","People from certain cultural groups (e.g., military veterans, african americans, asian americans) often will not endorse many symptoms on the screening measure, but when you ask them after they have gotten to know and trust you, and understand the intent of question better, they are more likely to report depression symptoms.",6. agree
"Clients cannot always identify their depression. W others, they catastrophizing and the schedule causes suggestibility","Clients cannot always identify their depression. W others, they catastrophizing and the schedule causes suggestibility",4. neutral
"When are you going to, they should be a very high validilty and reliability, but they should not be used by themselves without clinical judgment","When are you going to, they should be a very high validilty and reliability, but they should not be used by themselves without clinical judgment","5. somewhat
agree"
"It's important to use both standardized assessment measures and clinical judgment. For example, a patient may score moderately high on the PHQ-9, but when each item is examined, it shows that a large part of their score is due to fatigue and difficulty sleeping (which they attribute to a new job), and difficulty concentrating (which you attribute to their comorbid diagnosis of ADHD). They aren't showing symptoms of low mood or anhedonia (one of which is necessary for a diagnosis). Then you have to use your clinical judgment, and not just the cutoff for the measure, to determine what the situation is.","It's important to use both standardized assessment measures and clinical judgment. For example, a patient may score moderately high on the PHQ-9, but when each item is examined, it shows that a large part of their score is due to fatigue and difficulty sleeping (which they attribute to a new job), and difficulty concentrating (which you attribute to their comorbid diagnosis of ADHD). They aren't showing symptoms of low mood or anhedonia (one of which is necessary for a diagnosis). Then you have to use your clinical judgment, and not just the cutoff for the measure, to determine what the situation is.","5. somewhat
agree"
"IF you are assessing for assessment sake, it might be necessary to distinguish PDD from MDD and more standardized measures would help with that.   I find that for treatment purposes the EBP aren't so different for one or another so the time spent differentiating is not necessarily time/money effectively spent.","IF you are assessing for assessment sake, it might be necessary to distinguish PDD from MDD and more standardized measures would help with that. I find that for treatment purposes the EBP aren't so different for one or another so the time spent differentiating is not necessarily time/money effectively spent.","5. somewhat
agree"
Getting each client's personal experience is also important as well as the tools.,Getting each client's personal experience is also important as well as the tools.,6. agree
"I think it is important for psychiatry to assess depression with accuracy with the aim of medicating if necessary. On the clinical side, I am interested in the lived experience of the patient which sometimes but not always aligns with standard assessment outcomes.","I think it is important for psychiatry to assess depression with accuracy with the aim of medicating if necessary. On the clinical side, I am interested in the lived experience of the patient which sometimes but not always aligns with standard assessment outcomes.","3. somewhat
disagree"
"Standardized assessments are very valuable, especially in research and cases in which diagnosis is unclear. Sometimes diagnosis is simple and we can dedicate more time to treatment","Standardized assessments are very valuable, especially in research and cases in which diagnosis is unclear. Sometimes diagnosis is simple and we can dedicate more time to treatment",4. neutral
"I vissa fall är det så uppenbart att symtombilden matchar DSM-kriterierna att ingen ytterligare bekräftelse krävs, speciellt då de flesta skattnignsskalor bygger på samma definition av diagnosen.","In some cases, it is so obvious that the symptom picture matches the DSM criteria that no further confirmation is required, especially since most rating scales are based on the same definition of the diagnosis.",4. neutral
"Hur viktigt det är handlar främst om differentialdiagnostik och hur ofta detta riskerar leda till ineffektiv behandling. Om en behandling ger god symptomlindring är det den viktigaste punkten. Därav vikten av utvärdering allt eftersom. Dock, om det finns något enkelt verktyg som kan med hög validitet och tillförlitlighet hjälpa till med differentialdiagnosticering så är det absolut användbart med att minska ineffektiva behandlingar och därmed något som jag gärna använder.","The importance of this is mainly about differential diagnosis and how often this risks leading to ineffective treatment. If a treatment provides good symptom relief, that is the most important point. Hence the importance of evaluation as you go along. However, if there is a simple tool that can help with differential diagnosis with high validity and reliability, it is absolutely useful in reducing ineffective treatments and thus something I am happy to use.","5. somewhat
agree"
It is very important to have consistency this allows you to see if there has been any improvement at subsequent assessments,It is very important to have consistency this allows you to see if there has been any improvement at subsequent assessments,"1. strongly
disagree"
"Depression can manifest in different ways, some of which relate to living conditions and lack of freedoms caused my other medical conditions.","Depression can manifest in different ways, some of which relate to living conditions and lack of freedoms caused my other medical conditions.","5. somewhat
agree"
I agree that it is best to have standardised approach however in my usual practice I tend to identify patients at high risk rather than making a final diagnosis and starting anything beyond initial treatment,I agree that it is best to have standardised approach however in my usual practice I tend to identify patients at high risk rather than making a final diagnosis and starting anything beyond initial treatment,"3. somewhat
disagree"
This way it a fair system for all it individual approach is also needed,This way it a fair system for all it individual approach is also needed,2. disagree
Clinician should also ideally have experience to use own judgement,Clinician should also ideally have experience to use own judgement,2. disagree
"I think that qualitative information can provide a much richer detail of the persons experiences. Standardised assessment measures assume that we are measuring a construct of something - e.g. a disease process, rather than the subjective experiences of individuals.","I think that qualitative information can provide a much richer detail of the persons experiences. Standardised assessment measures assume that we are measuring a construct of something - e.g. a disease process, rather than the subjective experiences of individuals.","5. somewhat
agree"
"These are useful, but you also need unstructured assessments to glean more information","These are useful, but you also need unstructured assessments to glean more information",2. disagree
A standardized approach will not work for every patient which is why adapting the approach using clinical experience and knowledge is important.,A standardized approach will not work for every patient which is why adapting the approach using clinical experience and knowledge is important.,"5. somewhat
agree"
"People do not generally fit into a box as such, and  the standardised tests are not 'one size fits all'.","People do not generally fit into a box as such, and the standardised tests are not 'one size fits all'.","3. somewhat
disagree"
This is important to recognise and treat depression appropriately. If not it could be over or under treated. It is also important to then measure whether a treatment is working or improvement has occurred.,This is important to recognise and treat depression appropriately. If not it could be over or under treated. It is also important to then measure whether a treatment is working or improvement has occurred.,2. disagree
Standardized tests for depression seem to be efficient for diagnosing depression.,Standardized tests for depression seem to be efficient for diagnosing depression.,"3. somewhat
disagree"
Depends very much on the settings of care situation,Depends very much on the settings of care situation,"3. somewhat
disagree"
"Generally agree, though not this alone - discussion/interview/getting to know the person just as important","Generally agree, though not this alone - discussion/interview/getting to know the person just as important",2. disagree
Often symptoms of depression are identified during informal assessments.,Often symptoms of depression are identified during informal assessments.,"3. somewhat
disagree"
"For diagnosis of depression, I agree that professionals should use a standardised approach to make the process fair. However, my role as a nurse involves assessing the patient holistically, therefore this involves a combination of methods; listening, asking questions, observing.","For diagnosis of depression, I agree that professionals should use a standardised approach to make the process fair. However, my role as a nurse involves assessing the patient holistically, therefore this involves a combination of methods; listening, asking questions, observing.",2. disagree
it is quite helpful in diagnosing the severity of the illness rather than the illness itself,it is quite helpful in diagnosing the severity of the illness rather than the illness itself,"3. somewhat
disagree"
No assessment tool is totally effective at all times,No assessment tool is totally effective at all times,"3. somewhat
disagree"
Each subject should be treated on a case by case basis.,Each subject should be treated on a case by case basis.,6. agree
"Depression in my opinion isn't such an ""on paper"" assessment, it's relative to the person. I suffer badly, but as it's been a constant in my life i'm good at hiding it. i'd imagine others are too.","Depression in my opinion isn't such an ""on paper"" assessment, it's relative to the person. I suffer badly, but as it's been a constant in my life i'm good at hiding it. i'd imagine others are too.","5. somewhat
agree"
"As it is something that is relative, of course you need the science in the background, but I suppose it is adaptive and on a person-to person basis.","As it is something that is relative, of course you need the science in the background, but I suppose it is adaptive and on a person-to person basis.",2. disagree
Sometimes people can seem like they are functioning okay so its best to get to know the individual and how they cope.,Sometimes people can seem like they are functioning okay so its best to get to know the individual and how they cope.,"5. somewhat
agree"
"Jag tycker frågan är tvetydigt ställd. Om jag använder skattningsskalor så är det mycket viktigt att de är validerade. Däremot anser jag inte att det är viktigt att alltid använda skattningsskalor /andra instrument vid bedömning av depression. För differentialdiagnostik tycker jag att Mini är mycket användbart, speciellt om patienten inte svarar på given depressionsbehandling.","I think the question is ambiguous. If I use rating scales, it is very important that they are validated. However, I do not think it is important to always use rating scales/other instruments when assessing depression. For differential diagnosis, I think Mini is very useful, especially if the patient does not respond to given depression treatment.","1. strongly
disagree"
Standardized assessments are useful for comparing notes and findings,Standardized assessments are useful for comparing notes and findings,"7. strongly
agree"
