original,translation,Agreement
"Using standardized assessment methods with high validity and reliability is crucial when assessing depression. These methods ensure accurate and consistent measurement of symptoms, reducing bias and improving diagnosis and treatment. Tools like the PHQ-9 or BDI provide a structured, evidence-based framework, enhancing patient outcomes and enabling comparisons across studies. Combining standardized assessments with clinical judgment allows for a more personalized and effective approach to care","Using standardized assessment methods with high validity and reliability is crucial when assessing depression. These methods ensure accurate and consistent measurement of symptoms, reducing bias and improving diagnosis and treatment. Tools like the PHQ-9 or BDI provide a structured, evidence-based framework, enhancing patient outcomes and enabling comparisons across studies. Combining standardized assessments with clinical judgment allows for a more personalized and effective approach to care",6. agree
"When assessing depression, using standardized assessment methods that are validated and reliable is crucial for several reasons:

Validity: Validity refers to how accurately an assessment method measures what it intends to measure—in this case, depression. High validity ensures that the tool effectively captures the symptoms, severity, and impact of depression on an individual's life. Valid assessments help in making accurate diagnoses and treatment decisions.

Reliability: Reliability indicates the consistency of results produced by an assessment method when used repeatedly under similar conditions. A reliable assessment method yields consistent results across different occasions and settings, which is essential for monitoring changes in depressive symptoms over time and evaluating treatment effectiveness.","When assessing depression, using standardized assessment methods that are validated and reliable is crucial for several reasons: Validity: Validity refers to how accurately an assessment method measures what it intends to measure—in this case, depression. High validity ensures that the tool effectively captures the symptoms, severity, and impact of depression on an individual's life. Valid assessments help in making accurate diagnoses and treatment decisions. Reliability: Reliability indicates the consistency of results produced by an assessment method when used repeatedly under similar conditions. A reliable assessment method yields consistent results across different occasions and settings, which is essential for monitoring changes in depressive symptoms over time and evaluating treatment effectiveness.","5. somewhat
agree"
"When using a standardised questionnaire, it is important it has high validity and reliability so it can be relied upon when decision making and can be used for comparisons","When using a standardised questionnaire, it is important it has high validity and reliability so it can be relied upon when decision making and can be used for comparisons","7. strongly
agree"
"I believe there is a place in majority cases to use a structured, pre-existing approach however mental illness is unpredictable and as broad in category as the types of personalities that walk through the door so some improvisation and tailoring to suit the patient is necessary.","I believe there is a place in majority cases to use a structured, pre-existing approach however mental illness is unpredictable and as broad in category as the types of personalities that walk through the door so some improvisation and tailoring to suit the patient is necessary.","5. somewhat
agree"
"I use the PHQ-9 for all patients, even those who I am not treating for depression as a standard measure","I use the PHQ-9 for all patients, even those who I am not treating for depression as a standard measure","7. strongly
agree"
"It is important to use these tests and scores, but it is also crucial to offer open dialogue.","It is important to use these tests and scores, but it is also crucial to offer open dialogue.",6. agree
I wouldn't say strongly agree because even though I believe in science base on evidence with mental health it varies a lot and its not a square,I wouldn't say strongly agree because even though I believe in science base on evidence with mental health it varies a lot and its not a square,"5. somewhat
agree"
I think that a balance of non-standardized and standardized is good because every patient is unique in how they present some depression at the same time presenting similar characteristics.,I think that a balance of non-standardized and standardized is good because every patient is unique in how they present some depression at the same time presenting similar characteristics.,"5. somewhat
agree"
Mental issues and diseases usually are subjective in symptoms so it is necessary to complement the clinical information with other methods to make a good diagnosis.,Mental issues and diseases usually are subjective in symptoms so it is necessary to complement the clinical information with other methods to make a good diagnosis.,"7. strongly
agree"
"although there are standardized assessment methods, its important to consider other things that dont necessarily fall into a standard method.","although there are standardized assessment methods, its important to consider other things that dont necessarily fall into a standard method.","5. somewhat
agree"
I think a lot of the time depression  is not so black and white. I think these assessments should be used as a guide rather than dictate what we do,I think a lot of the time depression is not so black and white. I think these assessments should be used as a guide rather than dictate what we do,"5. somewhat
agree"
I think it is important to have some bases,I think it is important to have some bases,6. agree
"in theory the assessment is good, but accuracy depends on the patients truthfulness when taking it.","in theory the assessment is good, but accuracy depends on the patients truthfulness when taking it.",4. neutral
For continuity and best practice,For continuity and best practice,"7. strongly
agree"
"whilst the assessment can be useful in a diagnosis of depression, I do not solely use it as a means to diagnose the patient instead I use it as a whole package. the assessment by itself can sometimes give false positives and I have to use my clinical experience in sifting through results like false positives","whilst the assessment can be useful in a diagnosis of depression, I do not solely use it as a means to diagnose the patient instead I use it as a whole package. the assessment by itself can sometimes give false positives and I have to use my clinical experience in sifting through results like false positives","5. somewhat
agree"
"Every individual can show or show not the classic symptoms, but it is the whole picture that needs to be taken into consideration","Every individual can show or show not the classic symptoms, but it is the whole picture that needs to be taken into consideration","3. somewhat
disagree"
"I consider that the different evaluation instruments are important because they allow us to differentiate, rule out or identify it from some other disorders.","I consider that the different evaluation instruments are important because they allow us to differentiate, rule out or identify it from some other disorders.","1. strongly
disagree"
it is very important to have a clear and accurate diagnosis of depression since it can threaten a patient’s dignity and life. using standardized tests is vital to trust the diagnosis and having no mistakes,it is very important to have a clear and accurate diagnosis of depression since it can threaten a patient’s dignity and life. using standardized tests is vital to trust the diagnosis and having no mistakes,"7. strongly
agree"
But experience and knowing the patient works as well if not better,But experience and knowing the patient works as well if not better,"5. somewhat
agree"
"I worked on a unit that assessed for depression but did not re-assess very frequently as the treatments had began and psychiatrist were involved at this point with their assessments. But if we found them to be not responding, worsening based on our clinical experience we would inform their treating prescriber and see if changes should be made or if treatment should continue.","I worked on a unit that assessed for depression but did not re-assess very frequently as the treatments had began and psychiatrist were involved at this point with their assessments. But if we found them to be not responding, worsening based on our clinical experience we would inform their treating prescriber and see if changes should be made or if treatment should continue.","7. strongly
agree"
NOTHING,NOTHING,4. neutral
A degree of personal nuance should be applied. Each individual case is different.,A degree of personal nuance should be applied. Each individual case is different.,6. agree
"Agreed, alongside clinical judgement","Agreed, alongside clinical judgement","7. strongly
agree"
"Standard measures are key but without talking more in depth with patient we miss outliers that measures alone are inadequate for.  This can be due to lack of acceleration to expressing oneself through standard measure reply,or people who over report on measures.","Standard measures are key but without talking more in depth with patient we miss outliers that measures alone are inadequate for. This can be due to lack of acceleration to expressing oneself through standard measure reply,or people who over report on measures.",6. agree
"While I think standardized assessments are pretty important, I do think there is always room for other methods.","While I think standardized assessments are pretty important, I do think there is always room for other methods.","5. somewhat
agree"
EBP backed,EBP backed,"7. strongly
agree"
"I partially agree with this statement as it provides clinicians with proven methods to diagnose depression. However, it’s still vital to use a patient-centered approach to understand other psychological contexts that manifest in depression.","I partially agree with this statement as it provides clinicians with proven methods to diagnose depression. However, it’s still vital to use a patient-centered approach to understand other psychological contexts that manifest in depression.","5. somewhat
agree"
"Evidenced based research is always the best practice, but it is also important to use your own clinical judgement. Not everyone fits in align with a scale.","Evidenced based research is always the best practice, but it is also important to use your own clinical judgement. Not everyone fits in align with a scale.","7. strongly
agree"
This is an important screening tool that should be consistent and reproducible.,This is an important screening tool that should be consistent and reproducible.,"7. strongly
agree"
Every patient is different and assessment tools do not always cover every patient. You need to use your own clinical judgement and experience,Every patient is different and assessment tools do not always cover every patient. You need to use your own clinical judgement and experience,"3. somewhat
disagree"
Depression can be assessed using a dimensional approach through self or clinician rated questionnaires.,Depression can be assessed using a dimensional approach through self or clinician rated questionnaires.,6. agree
"When it comes to maternal mental health there is a normal part of hormonal change and imbalance and we use the tools and scales to help identify if these feelings are more than the normal amount of hormonal imbalance. Hopefully identifying postnatal depression, postnatal psychosis and ongoing low mood and mental health sooner to advise support and help","When it comes to maternal mental health there is a normal part of hormonal change and imbalance and we use the tools and scales to help identify if these feelings are more than the normal amount of hormonal imbalance. Hopefully identifying postnatal depression, postnatal psychosis and ongoing low mood and mental health sooner to advise support and help","5. somewhat
agree"
"Although the 9 question questionnaire is a quick and easy indicator of depression, follow up and visits are crucial. Social activities to boost wellbeing I think has NO substitute and is more effective than pills. 

I do not believe in standardising the assessment as individuals are different. Others prefer paperwork and ticking of boxes but others find this lacking sincerity and want face to face interviews where the assessor and the assessed can see each other's faces. Writing whilst interviewing can mean ""just a work"" and ""lacking personal touch"" especially when the assessor is just minding the inputting of responses.","Although the 9 question questionnaire is a quick and easy indicator of depression, follow up and visits are crucial. Social activities to boost wellbeing I think has NO substitute and is more effective than pills. I do not believe in standardising the assessment as individuals are different. Others prefer paperwork and ticking of boxes but others find this lacking sincerity and want face to face interviews where the assessor and the assessed can see each other's faces. Writing whilst interviewing can mean ""just a work"" and ""lacking personal touch"" especially when the assessor is just minding the inputting of responses.",2. disagree
Measures/structured interviews tend to look at surface level. I think it's good to use these as screening but think they miss much of the complexity of human experience.,Measures/structured interviews tend to look at surface level. I think it's good to use these as screening but think they miss much of the complexity of human experience.,"5. somewhat
agree"
i am in different when it comes to this,i am in different when it comes to this,4. neutral
n/a,n/a,"5. somewhat
agree"
Evidence based practice is the best way to achieve verge vest outcome but I guess all cases must be looked at individually.,Evidence based practice is the best way to achieve verge vest outcome but I guess all cases must be looked at individually.,6. agree
Standardized assessment is crucial to avoid subjective data,Standardized assessment is crucial to avoid subjective data,6. agree
"Standardized assessment methods tend to be of extreme help when assessing depression, but some patients tend to be outliers or not be completely honest it's important to factor in the human error as well as other clinical information that a physician has gathered from the patient must be weighed in with standardized assessment methods utilized.","Standardized assessment methods tend to be of extreme help when assessing depression, but some patients tend to be outliers or not be completely honest it's important to factor in the human error as well as other clinical information that a physician has gathered from the patient must be weighed in with standardized assessment methods utilized.",6. agree
"Jag uppfattar att standardiserade metoder är väldigt värdefulla i den kliniska bedömningen, både informationsinhämtning och  kommunikationen med patienterna och kollegorna. Samtidigt är det svårt att fånga in samtliga personer med enbart standardiserade instrument utan kommer alltid i viss mån behövas en samlad klinisk bedömning.","I find that standardized methods are very valuable in clinical assessment, both information gathering and communication with patients and colleagues. At the same time, it is difficult to capture all people with standardized instruments alone, but will always be needed to some extent a comprehensive clinical assessment.",6. agree
Low mood can be fleeting so it's important to have a standardized way to identify true depression.,Low mood can be fleeting so it's important to have a standardized way to identify true depression.,"7. strongly
agree"
I have nothing to add here,I have nothing to add here,4. neutral
"I agree that standardised assessments have a high degree of accuracy, but I think you also need you add in the clinician assessment which only comes from experience","I agree that standardised assessments have a high degree of accuracy, but I think you also need you add in the clinician assessment which only comes from experience",6. agree
This amongst other information gained ftom patients and relatives if deemed appropriate,This amongst other information gained ftom patients and relatives if deemed appropriate,"5. somewhat
agree"
"I agree with the statement, however clinical experience needs to be taken into account as well.","I agree with the statement, however clinical experience needs to be taken into account as well.",6. agree
"People are not often completely honest with standardized assessment tools, often minimizing the degree of their depression.  Unstructured interviews, over time, build trust and are much more likely to result in a true picture of what the client is experiencing.","People are not often completely honest with standardized assessment tools, often minimizing the degree of their depression. Unstructured interviews, over time, build trust and are much more likely to result in a true picture of what the client is experiencing.",2. disagree
Much is measured upo pervious clinical studies and treatment.,Much is measured upo pervious clinical studies and treatment.,6. agree
Each individual must be evaluated on case by case situation.,Each individual must be evaluated on case by case situation.,6. agree
Sometimes people don’t got into the questions,Sometimes people don’t got into the questions,6. agree
Standardized assessment methods are important but should not be relied on exclusively,Standardized assessment methods are important but should not be relied on exclusively,6. agree
Its vital to consult an agreed upon standard when diagnosing depression or severe anxiety disorders. This can act as a guide into the severity of the disorder and will assist when coming up wit recommendations. However its important to also do other medical tests before deciding to use the tools available for diagnosing depression.,Its vital to consult an agreed upon standard when diagnosing depression or severe anxiety disorders. This can act as a guide into the severity of the disorder and will assist when coming up wit recommendations. However its important to also do other medical tests before deciding to use the tools available for diagnosing depression.,6. agree
I just report what I've observed and refer out to PCP,I just report what I've observed and refer out to PCP,4. neutral
"Standardized assessments may be very good at measuring a condition for 99% of the people; however, we know that there are always cases that don't fit into the mold of these tests. Its best to use a combination of your expertise and assessments.","Standardized assessments may be very good at measuring a condition for 99% of the people; however, we know that there are always cases that don't fit into the mold of these tests. Its best to use a combination of your expertise and assessments.",6. agree
All diagnoses should be based on tools that have had extensive clinical research as to ensure an accurate diagnosis is done.,All diagnoses should be based on tools that have had extensive clinical research as to ensure an accurate diagnosis is done.,"7. strongly
agree"
"The standardized assessments have been studied and tested across a wide range of patients that they are bound to be reliable for a lot of patients but sometimes, there are some patients that fall outside the scale even though they are indeed battling depression.","The standardized assessments have been studied and tested across a wide range of patients that they are bound to be reliable for a lot of patients but sometimes, there are some patients that fall outside the scale even though they are indeed battling depression.",6. agree
Important to use them but not to solely rely on them,Important to use them but not to solely rely on them,"5. somewhat
agree"
I think a conversation alone can help diagnose depression.,I think a conversation alone can help diagnose depression.,4. neutral
Use assessment tool that is scientifically researched to be reliable and accurate is very important. Also the use of assessment that is quick to identify is important during a busy schedule.,Use assessment tool that is scientifically researched to be reliable and accurate is very important. Also the use of assessment that is quick to identify is important during a busy schedule.,6. agree
I think it is very useful to follow this but sometimes depending on the patient you need to be flexible and think outside of the box.,I think it is very useful to follow this but sometimes depending on the patient you need to be flexible and think outside of the box.,"5. somewhat
agree"
"In the medical field, you cannot stray from these methods often or officially as it would be malpractice.","In the medical field, you cannot stray from these methods often or officially as it would be malpractice.",6. agree
"While it is helpful to use standardized assessment methods, it’s also important to go outside of these assessments and have an open and unstructured conversation with the patient.","While it is helpful to use standardized assessment methods, it’s also important to go outside of these assessments and have an open and unstructured conversation with the patient.","5. somewhat
agree"
I believe in taking a holistic approach and have to see the entire picture.,I believe in taking a holistic approach and have to see the entire picture.,"3. somewhat
disagree"
"Psychiatry is still developing, so it needs to be based on evidence and methods that have been proven to be reliable in the past to make decisions.","Psychiatry is still developing, so it needs to be based on evidence and methods that have been proven to be reliable in the past to make decisions.",6. agree
Everyone has different symptoms related to depression,Everyone has different symptoms related to depression,"5. somewhat
agree"
Patients know when they're depressed. I prefer to believe patients when they tell me their experiences.,Patients know when they're depressed. I prefer to believe patients when they tell me their experiences.,2. disagree
"evidence based practice is always best, and measures used should include both high validity and reliabilty","evidence based practice is always best, and measures used should include both high validity and reliabilty","7. strongly
agree"
I will use standardised methods but I also feel unstructured interviewing is the best way to get a patient to open up about how they are feeling. The assessment methods are a supplementary tool to my clinical experience in recognising depression.,I will use standardised methods but I also feel unstructured interviewing is the best way to get a patient to open up about how they are feeling. The assessment methods are a supplementary tool to my clinical experience in recognising depression.,6. agree
In conversation you can usually assess for depression if people are open and honest. The questionnaire and scales help to see how it is impacting people’s lives and show signs of improvement or deterioration.,In conversation you can usually assess for depression if people are open and honest. The questionnaire and scales help to see how it is impacting people’s lives and show signs of improvement or deterioration.,6. agree
Allows for continued review if seen by a different clinician,Allows for continued review if seen by a different clinician,"7. strongly
agree"
Having high value and reliability means that these methods are tried and tested and have proved to be invaluable in the diagnosis and treatment of depressive disorders,Having high value and reliability means that these methods are tried and tested and have proved to be invaluable in the diagnosis and treatment of depressive disorders,6. agree
"Although I agree it is helpful to use standardised methods that are tied and tested, not all people will come across the same and individuality should be taken into account","Although I agree it is helpful to use standardised methods that are tied and tested, not all people will come across the same and individuality should be taken into account",6. agree
"Personal experience and familiarity with the patient (as in primary care) is more important by far, than a one-size-fits-all questionnaire","Personal experience and familiarity with the patient (as in primary care) is more important by far, than a one-size-fits-all questionnaire","3. somewhat
disagree"
Assesment methods are fine but I believe human interaction is a very good way to make a clearer assesment.,Assesment methods are fine but I believe human interaction is a very good way to make a clearer assesment.,"5. somewhat
agree"
